{
  "model_name": "Claude (Anthropic)",
  "short_description": "Closed-weight multimodal AI assistant family (Opus, Sonnet, Haiku) with extended context and agentic capabilities.",
  "homepage": "https://www.anthropic.com/claude",
  "model_card_link": "https://docs.anthropic.com/en/docs/about-claude/models/overview",
  "license": "Anthropic API Terms of Use",
  "provenance": {
    "provider": "Anthropic",
    "release_date": "2024-03-04",
    "notes": "Claude 3 family launched March 2024; Claude 3.5 Sonnet June 2024; Claude 4 family May 2025; Claude 4.5 series Aug-Nov 2025."
  },
  "input_types": [
    "text",
    "image"
  ],
  "output_types": [
    "text"
  ],
  "architecture_family": "multimodal transformer",
  "architecture_details": "Proprietary transformer architecture with constitutional AI training; extended 200K-1M token context windows; optimized for agentic workflows and computer use.",
  "size_params": {
    "notable_variants": [
      "claude-fable-5",
      "claude-fable-5",
      "claude-fable-5",
      "claude-opus-4.6",
      "claude-opus-4.5",
      "claude-opus-4.1",
      "claude-sonnet-4.5",
      "claude-sonnet-4",
      "claude-haiku-4.5",
      "claude-haiku-4"
    ],
    "activated_params_note": "Parameter counts are undisclosed; API users access hosted inference endpoints."
  },
  "capabilities": {
    "multimodal": true,
    "function_calling": true,
    "tool_use": true,
    "computer_use": "Claude Sonnet 4.5 and Opus 4.5 support computer use API for agentic tasks.",
    "streaming": true,
    "extended_context": "200K tokens standard; 1M token beta available for Sonnet 4 and 4.5."
  },
  "tags": [
    "closed-weight",
    "api",
    "multimodal",
    "agentic",
    "extended-context"
  ],
  "variants": [
    {
      "name": "claude-fable-5",
      "params": 1,
      "context_windows": [
        0
      ],
      "default_seq_len": 0,
      "default_num_gpus": 0,
      "model_card_link": "https://platform.claude.com/docs/en/about-claude/models/introducing-claude-fable-5-and-claude-mythos-5",
      "release_date": "unknown",
      "hardware_recommendations": {
        "notes": "Hosted via Anthropic API, AWS. Supports long-running asynchronous execution and advanced vision capabilities."
      },
      "tags": [
        "coding",
        "agentic"
      ]
    },
    {
      "name": "claude-fable-5",
      "params": 1,
      "context_windows": [
        200000,
        1000000
      ],
      "default_seq_len": 200000,
      "default_num_gpus": 0,
      "model_card_link": "https://platform.claude.com/docs/en/about-claude/models/introducing-claude-fable-5-and-claude-mythos-5",
      "release_date": "2025-06-01",
      "hardware_recommendations": {
        "notes": "Hosted via Anthropic API, AWS Bedrock. Supports long-running asynchronous execution and advanced vision capabilities."
      },
      "tags": [
        "flagship",
        "reasoning",
        "coding",
        "agentic"
      ]
    },
    {
      "name": "claude-fable-5",
      "params": 1,
      "context_windows": [
        200000,
        1000000
      ],
      "default_seq_len": 200000,
      "default_num_gpus": 0,
      "model_card_link": "https://platform.claude.com/docs/en/about-claude/models/introducing-claude-fable-5-and-claude-mythos-5",
      "release_date": "2025-06-01",
      "hardware_recommendations": {
        "notes": "Hosted via Anthropic API, AWS Bedrock. Supports long-running asynchronous execution and advanced vision capabilities."
      },
      "tags": [
        "flagship",
        "reasoning",
        "coding",
        "agentic"
      ]
    },
    {
      "name": "claude-opus-4.6",
      "params": 1,
      "context_windows": [
        200000,
        1000000
      ],
      "default_seq_len": 200000,
      "default_num_gpus": 0,
      "model_card_link": "https://www.anthropic.com/news/claude-opus-4-6",
      "release_date": "2026-06-15",
      "hardware_recommendations": {
        "notes": "Hosted via Anthropic API; next-generation reasoning and agentic capabilities."
      },
      "tags": [
        "flagship",
        "reasoning",
        "coding",
        "agentic"
      ]
    },
    {
      "name": "claude-opus-4.5",
      "params": 1,
      "context_windows": [
        200000,
        1000000
      ],
      "default_seq_len": 200000,
      "default_num_gpus": 0,
      "model_card_link": "https://www.anthropic.com/news/claude-opus-4-5",
      "release_date": "2025-11-24",
      "hardware_recommendations": {
        "notes": "Hosted via Anthropic API, AWS Bedrock, Google Vertex AI; strongest reasoning and coding model."
      },
      "tags": [
        "flagship",
        "reasoning",
        "coding",
        "agentic"
      ]
    },
    {
      "name": "claude-opus-4.1",
      "params": 1,
      "context_windows": [
        200000
      ],
      "default_seq_len": 200000,
      "default_num_gpus": 0,
      "model_card_link": "https://docs.anthropic.com/en/docs/about-claude/models/overview",
      "release_date": "2025-08-05",
      "hardware_recommendations": {
        "notes": "Hosted via Anthropic API; optimized for agentic tasks and real-world coding."
      },
      "tags": [
        "agentic",
        "coding"
      ]
    },
    {
      "name": "claude-sonnet-4.5",
      "params": 1,
      "context_windows": [
        200000,
        1000000
      ],
      "default_seq_len": 200000,
      "default_num_gpus": 0,
      "model_card_link": "https://www.anthropic.com/news/claude-3-5-sonnet",
      "release_date": "2025-09-29",
      "hardware_recommendations": {
        "notes": "Hosted via Anthropic API; best coding model in the world, #1 on SWE-bench and Terminal-Bench."
      },
      "tags": [
        "flagship",
        "coding",
        "computer-use",
        "agentic"
      ]
    },
    {
      "name": "claude-sonnet-4",
      "params": 1,
      "context_windows": [
        200000,
        1000000
      ],
      "default_seq_len": 200000,
      "default_num_gpus": 0,
      "model_card_link": "https://docs.anthropic.com/en/docs/about-claude/models/overview",
      "release_date": "2025-05-22",
      "hardware_recommendations": {
        "notes": "Hosted via Anthropic API; balanced performance and cost."
      },
      "tags": [
        "balanced",
        "multimodal"
      ]
    },
    {
      "name": "claude-haiku-4.5",
      "params": 1,
      "context_windows": [
        200000
      ],
      "default_seq_len": 200000,
      "default_num_gpus": 0,
      "model_card_link": "https://www.anthropic.com/news/claude-haiku-4-5",
      "release_date": "2025-10-01",
      "hardware_recommendations": {
        "notes": "Hosted via Anthropic API; similar coding performance to Sonnet 4 at 1/3 cost and 2x speed."
      },
      "tags": [
        "cost-optimized",
        "fast",
        "coding"
      ]
    },
    {
      "name": "claude-haiku-4",
      "params": 1,
      "context_windows": [
        200000
      ],
      "default_seq_len": 200000,
      "default_num_gpus": 0,
      "model_card_link": "https://docs.anthropic.com/en/docs/about-claude/models/overview",
      "release_date": "2025-05-22",
      "hardware_recommendations": {
        "notes": "Hosted via Anthropic API; fastest and most cost-efficient model for high-volume tasks."
      },
      "tags": [
        "cost-optimized",
        "fast"
      ]
    }
  ],
  "evaluation": {
    "papers": [
      "https://www-cdn.anthropic.com/de8ba9b01c9ab7cbabf5c33b80b7bbc618857627/Model_Card_Claude_3.pdf"
    ],
    "benchmarks": [
      "mmlu",
      "mmlu_pro",
      "gpqa",
      "swebench",
      "terminalbench",
      "livecodebench",
      "aime25",
      "benchmark.claweval",
      "drivingbench"
    ],
    "model_cards": [
      "https://docs.anthropic.com/en/docs/about-claude/models/overview",
      "https://www.anthropic.com/news/claude-haiku-4-5",
      "https://www.anthropic.com/news/claude-3-5-sonnet"
    ]
  },
  "inference": {
    "latency_ms": null,
    "latency_level": "variable (API-managed)",
    "throughput_rps": null,
    "concurrency": null,
    "memory_gb": null,
    "quantization_friendly": false,
    "supported_hardware": [
      "Anthropic API",
      "AWS Bedrock",
      "Google Vertex AI"
    ],
    "distributed_support": false,
    "notes": "Requests served from Anthropic-managed infrastructure. Available via API, AWS Bedrock, and Google Vertex AI. Haiku 4.5 offers 2x speed of Sonnet 4 at 1/3 cost."
  },
  "notes": "Consolidates Anthropic Claude API endpoints (text, multimodal, agentic). Variant parameters are placeholders because Anthropic does not disclose parameter counts. Key benchmarks (2025): Opus 4.5 ~90% MMLU-Pro, 44% Terminal-Bench Hard; Sonnet 4.5 77.2% SWE-bench Verified, #1 on coding benchmarks; Haiku 4.5 73.3% SWE-bench Verified, 90% of Sonnet 4.5 performance at 1/3 cost."
}