{
  "model_name": "Kimi-Audio",
  "input_types": ["audio"],
  "output_types": ["text"],
  "architecture_family": "encoder-decoder",
  "variants": [
    {"name": "base", "params": 1, "context_windows": [30000], "default_seq_len": 30000, "default_num_gpus": 1}
  ],
  "notes": "Placeholder entry; update with accurate Kimi-Audio details."
}
